,User,Text,Date,Favorites,Retweets,Mentions,HashTags,Search Keywords
761,gbond,The cure for Asian flush symptoms turns out to be a promising drug to treat Covid. Mind blown ,2020-04-28 00:50:21+00:00,0.0,1.0,,,covid
762,yoelperalta21,Siento mucho la pérdida de tu hermano por culpa del Covid 19 @RayInfante EPD,2020-04-28 00:50:09+00:00,0.0,0.0,@RayInfante,,covid
763,dpcapturemoment,COVID-19 updates for the US #covid19,2020-04-28 00:44:25+00:00,0.0,0.0,,#covid19,covid
764,SpoonsTt,#MeatlessMonday #dinner #covid_19 #stayathome #gameplan #asparagus #pasta shells with #lemon #butter sauce All items were purchased from Stop &amp; Shop #vegetarian #vitaminK #prebiotic #vitaminC #homecook #foodie… https://www.instagram.com/p/B_gS8IYDaM9/?igshid=140vv9eu0ezc9,2020-04-28 00:35:20+00:00,0.0,0.0,,#MeatlessMonday #dinner #covid_19 #stayathome #stayathome #gameplan #asparagus #pasta #lemon #butter #vegetarian #vitaminK #vitaminC #homecook #foodie,covid
765,kush_jones_,Viruses can mutate. I’d like to know that if people having strokes are a mutation of Covid-19. Also do mutations occur where there is more saturation of the virus? We just now getting on the ball with testing. Hope we learn more before this thing wipes more people out.,2020-04-28 00:33:27+00:00,1.0,11.0,,,covid
766,RobertScuz,"COVID-19...never forget __ #covid19 #coronavirus #quarantine #lockdown #newyork #nyc #AMN #alephmedianetwork #amnfilms #amnproductions #media #videography #cinematography #content @New York, New York https://www.instagram.com/p/B_gRaEcDaiF/?igshid=1fx05sk3t8ejx",2020-04-28 00:23:17+00:00,0.0,0.0,,#covid19 #coronavirus #quarantine #lockdown #newyork #nyc #AMN #alephmedianetwork #amnfilms #amnproductions #media #videography #cinematography #content,covid
767,SKriegerMD,"Until today I felt a pang of guilt at 7pm each night, because I wasn’t a front-line provider. Today I was redeployed to a #COVID unit @MountSinaiNYC, and I am so proud to help serve our community. But let me tell you, the #residents, #nurses, &amp; #respiratorytherapists, are #Heroes",2020-04-28 00:20:07+00:00,21.0,298.0,@MountSinaiNYC,#COVID #residents #nurses #respiratorytherapists #Heroes,covid
768,TeflonWam,It’s sad it took Covid to really wake me up.,2020-04-28 00:18:34+00:00,1.0,1.0,,,covid
769,ShaunDrJames,They have to figure out the least weak sounding way to explain his death. Covid or botched surgery way to weak for a supreme leader. We gonna find out he was heli-skiing or died saving an animal because even monsters love dogs.,2020-04-28 00:18:27+00:00,3.0,18.0,,,covid
770,studio325nyc,"The COVID-19 pandemic has brought to bear on this sector, biotech is booming. Is your company positioned to benefit from the increased interest in health and wellness? Our team has the skills, experience, and Biotech marketing know-how to help you attain your marketing goals! ",2020-04-28 00:14:13+00:00,0.0,0.0,,,covid
771,TomYoun73632737,"@NYGovCuomo 4,000 lost “Matilda’s” due to incredibly stupid decisions putting Covid patients in Nursing Homes to convalesce. Hire a good lawyer.",2020-04-28 00:14:00+00:00,0.0,0.0,@NYGovCuomo,,covid
772,Afecto_al_Cocuy,With your logic: Cuomo and his cronies at MTA super spread COVID 19 in the very minority communities they claimed to protect Eres un ñángara imbecil ,2020-04-28 00:05:52+00:00,0.0,0.0,,,covid
773,TomYoun73632737,"So relatives can’t visit their senior relatives in Nursing Homes but the Governor can send recovering Covid patients to convalesce. How incredibly stupid? Don’t talk to us about Matilda. Cuomo didn’t give a damn about 4,000+ “Matilda’s”.",2020-04-28 00:05:51+00:00,0.0,0.0,,,covid
774,Brian63312130,"SPRING TIME IN THE NEIGHBORHOOD #spring #spring2020 #morningrun #williamsburgbrooklyn #mondaymadness #stayhome #covid_19 @Bedford Avenue, Williamsberg https://www.instagram.com/p/B_gPJ-sBKyx1RAiucqA2tV2g4lVHV4JP7uD8Ak0/?igshid=1aojfva4bx7hn",2020-04-28 00:02:16+00:00,0.0,0.0,,#spring #spring2020 #morningrun #williamsburgbrooklyn #mondaymadness #stayhome #stayhome #covid_19,covid
775,MrYdiaz,Monday night vibes #quarantine smoke #cigar #cohiba #bourbon #whisky #jeffersonoceanbourbon #caskstrength #covid_19 #coronavirus @Social 59 Eatery &amp; Lounge https://www.instagram.com/p/B_gOs0YjX40/?igshid=lor8nhr5yap9,2020-04-28 00:01:16+00:00,0.0,0.0,,#quarantine #cigar #cohiba #bourbon #whisky #jeffersonoceanbourbon #caskstrength #covid_19 #coronavirus,covid
776,lillybell295,"Open up San Diego and close all exits so they don’t go to other parts of the country spreading Covid , let them keep it in San Diego!",2020-04-28 00:01:15+00:00,0.0,0.0,,,covid
777,e_munson,"I’m about to lose my goddamn mind my landlord owns 7 buildings on my block, ~15 units each. we all do laundry in the basement of one building. four washers, four dryers. let’s just say that 60% of units are occupied, everyone else left bc of covid (63 units occupied)",2020-04-27 23:56:47+00:00,0.0,0.0,,,covid
778,MarcieGPell,"Que tristeza: uma médica do Pronto Socorro do Presbiterian Hospital, aqui de NY, que pegou e sarou do Covid, matou-se. Na carta de despedida ela fala que não consegue mais viver com o que ela tem vivido. O pai dela disse que ela contava casos terríveis. Muito triste.",2020-04-27 23:54:00+00:00,5.0,31.0,,,covid
779,GaileHolly,"Unfortunately I know from a very good, reliable source that all the States have inflated these numbers! Found out that a New Jersey family knew their lived one didn't die of Covid and had the Doctor correct the person's Death Certificate!",2020-04-27 23:51:10+00:00,0.0,0.0,,,covid
780,Visiona1re,914UNITED Inc has launched a @gofundme to acquire the assistance of a larger audience in continuing the support to the essential workers serving on the frontline of the COVID-19 pandemic. Tap the link :https://www.gofundme.com/f/914united-inc?utm_source=customer&amp;utm_medium=copy_link-tip&amp;utm_campaign=p_cp+share-sheet Any donation will help make an impact!,2020-04-27 23:50:29+00:00,1.0,2.0,@gofundme,,covid
781,thirdmillennium,"Reparations are definitely fucking in order!! It’s beyond late. And don’t forget the 40 acres & a mule bullshit. That didn’t materialize either, did it?who are these 2 racist pricks and how do we find them?! A retired DA. & his son making it even more heinous in these Covid Xs.",2020-04-27 23:47:16+00:00,0.0,6.0,,,covid
782,ashtraybitch_,"If you love him, let him flip your Covid check",2020-04-27 23:39:10+00:00,0.0,0.0,,,covid
783,nickwaplington,It’s all Orwellian double speak just like Johnson today stating what a great success the UK’s Covid response has been while the world laughs at us,2020-04-27 23:37:35+00:00,0.0,0.0,,,covid
784,moneymikewill," WTF COVID-19 UPDATE! The number of #covid19 infection rates is still rising in New Orleans. The LA Dept Health is now reporting 6,365 #COVID19 #Coronavirus cases in #NewOrleans 27,068 cases and 1,697 deaths in… https://www.instagram.com/p/B_gLhEDgAAU/?igshid=qzbmqelzldek",2020-04-27 23:30:37+00:00,0.0,0.0,,#covid19 #COVID19 #Coronavirus #NewOrleans,covid
785,NYCMariachi,"CREANDO CONCIENCIA CONTRA EL COVID-19: Nuestra estudiante del Conservatorio De Mariachi De La Ciudad De Nueva York, Valeria Cisneros SE QUEDA EN CASA! #quedateencasa #stayhome “Tradicion Del Suelo Mio” THE NEW… https://www.instagram.com/p/B_gKPWmDUjb/?igshid=tgw1sornp72c",2020-04-27 23:19:41+00:00,0.0,0.0,,#quedateencasa #quedateencasa #stayhome #stayhome,covid
786,HarveyCast,"Unfortunately our ΣΦΕ Brother, Xavier “El Guapo” Flores lost his battle with COVID-19 today. He was an exemplary brother, good friend, outstanding leader &amp; all around great person to know. You will never be… https://www.instagram.com/p/B_gKQviJs1r/?igshid=17g1uh050y5c2",2020-04-27 23:19:30+00:00,0.0,0.0,,,covid
787,pekochel,"Shirley posted this as the #openstreets criteria since we’ll be doing this COVID thing well into the summer. Vice chair says, this is for local residents “Not for outsiders to come into the area” good lord... almost. @CB2_Manhattan @TransAlt #bikeNYC #openstreets #finish6th",2020-04-27 23:17:02+00:00,0.0,4.0,@CB2_Manhattan @TransAlt,#openstreets #bikeNYC #openstreets #finish6th,covid
788,jdny2,Found out my trainer’s brother died of COVID. Why anyone would talk about opening things back up now I’ll never know.,2020-04-27 23:09:39+00:00,0.0,2.0,,,covid
789,pluna00,I ask myself this every day how much longer can we take this? #donlemon #TrumpLiesAmericansDie #StableGenius #NoblePrize #coronavirus #Covid_19 #COVID19,2020-04-27 23:09:13+00:00,0.0,1.0,,#donlemon #TrumpLiesAmericansDie #StableGenius #NoblePrize #coronavirus #Covid_19 #COVID19,covid
790,iamkaylab13,I’ve been working since this whole pandemic started and now because I was exposed to someone with Covid-19 I have to miss work for a week don’t know how to feel about that yet... but at least im still getting paid lol,2020-04-27 23:06:43+00:00,0.0,0.0,,,covid
791,dondidonde,"#clapbecausewecare #clapbecausewecarenyc #essentialworkers #hospitalworkers #newyorkcity #newyork #covid19 #covid_19 #coronavirus #wuhanvirus @New York, New York https://www.instagram.com/p/B_gIsh6HNkS/?igshid=1l0ok3f5nr4i",2020-04-27 23:05:48+00:00,0.0,2.0,,#clapbecausewecare #clapbecausewecarenyc #essentialworkers #hospitalworkers #newyorkcity #newyork #covid19 #covid_19 #coronavirus #wuhanvirus,covid
792,ryanlachica,Looking at Joe Lentol and alllllll his cronies. Bruh has not said one word abt the BOE bs. Not one word abt the austerity budget. Tweeting abt volunteers to sit w COVID patients &amp; mask tutorials. This is not leadership. This is a machine hack trying to get re-elected. So gross ,2020-04-27 23:04:31+00:00,0.0,1.0,,,covid
793,DrRobertGlatter,"it’s important to call 911 not only for difficulty breathing or chest pain, but also for stroke-like symptoms in the era of COVID-19. Time is brain is the take-home message. ",2020-04-27 22:53:37+00:00,2.0,4.0,,,covid
794,JuniousSmithIII,Lenoir County has two more succumb to COVID-19; two active 'outbreak' sites labeled ,2020-04-27 22:48:14+00:00,0.0,0.0,,,covid
795,tara_ogrady,"@johnkrasinski I’m an unemployed NYC jazz singer recovering from Covid, received $1000 grant from #LouisArmstrong foundation. #SomeGoodNews",2020-04-27 22:44:58+00:00,0.0,0.0,@johnkrasinski,#LouisArmstrong #SomeGoodNews,covid
796,ClaytonCraddock,"@queenesther ok...Here ya go. We know now that the risk of dying from COVID-19 is far lower than initially thought, and not significant for the overwhelming majority of those infected.",2020-04-27 22:43:45+00:00,0.0,1.0,@queenesther,,covid
797,shneusk,"Quarantine mood #catsofinstagram #covid @South Slope, Brooklyn https://www.instagram.com/p/B_gF1GgJZBb/?igshid=1k50uf1avpa3q",2020-04-27 22:40:45+00:00,0.0,0.0,,#catsofinstagram #covid,covid
798,MMATOpera,BREAKING NEWS: AntiVirus Hi-Tech Purity Solution up to 90 days Against COVID-19 https://meetmeattheopera.com/antivirus-hi-tech-solution-up-to-90-days-against-covid-19/ #antivirus #coronavirus #killcoronavirus #StayHome #antivirussolution #COVID19 #CoronavirusOutbreak #CoronavirusPandemic #CoronavirusNYC,2020-04-27 22:36:49+00:00,2.0,3.0,,#antivirus #coronavirus #killcoronavirus #StayHome #StayHome #antivirussolution #COVID19 #CoronavirusOutbreak #CoronavirusPandemic #CoronavirusNYC,covid
799,viaggiosport,"One love, one heart. United we win. Stay strong New York. #heart #newyork #covid #stayhome #rooftop #lowereastside #skyline #andratuttobene #coronavirus #lockdown ? Not so much here in NY @New York, New York https://www.instagram.com/p/B_gFQCwpcPM/?igshid=ywnl4jltdl0f",2020-04-27 22:36:24+00:00,0.0,0.0,,#heart #newyork #covid #stayhome #stayhome #rooftop #lowereastside #skyline #andratuttobene #coronavirus #lockdown,covid
800,prieta34,"Lo que pasa es que cuando no estaba el Covid-19 quien se jodia con los niños eran los maestros y ellos llegaban a dormir,que mamey verdad y ya les apestan que ahora dicen que pasan hambre que bonito ",2020-04-27 22:27:24+00:00,0.0,0.0,,,covid
801,KevinPeli,These are troubling times during the Covid-19 Pandemic. These are a couple of our speciality face covers that are perfect for you and your family protection. Visit us at http://www.fullyprivilege.com #fullyprivilege… https://www.instagram.com/p/B_gDifWgijV/?igshid=166imx1onal3m,2020-04-27 22:20:45+00:00,0.0,0.0,,#fullyprivilege,covid
802,PAbeywardena,This is fabulous - one of my faves @laylool on birthing during Covid-19 ,2020-04-27 22:20:42+00:00,0.0,1.0,@laylool,,covid
803,AngeloAtirado,"Children attend schools, they do not run them. The faculty and staff are adults. The same adults that are getting sick from covid-19 and some are losing their lives.",2020-04-27 22:17:20+00:00,0.0,0.0,,,covid
804,colderthan__ice,I really think I got COVID and beat it. The symptoms were mild but it still put me on my ass.,2020-04-27 22:15:00+00:00,0.0,0.0,,,covid
805,ReggieMCH,The Search For A Covid-19 Vaccine | Race Against Pandemic | Full Episode https://youtu.be/VSQnOS7t4Gg via @YouTube,2020-04-27 22:13:13+00:00,0.0,1.0,@YouTube,,covid
806,RpublicRestored,Patriots! Check out the @ofmindsofmen show! Couple of really cool guys from the great state of Texas! They were kind enough to have us on to discuss #coronavirus in #NYC &amp; the quality of life in #NY! Check it out! #covid #COVID19 #Covid_19 #Trump2020 #WWG1WGA #qanon #Q #MAGA,2020-04-27 22:10:24+00:00,0.0,0.0,@ofmindsofmen,#coronavirus #NYC #NY #covid #COVID19 #Covid_19 #Trump2020 #WWG1WGA #qanon #Q #MAGA,covid
807,simplykatricia,"Haven’t watched the news in days. Let’s see what mayhem is going on in NYC. Nothing but COVID. Does this mean crime is down, or it’s just not making it to the AM, Afternoon, Evening or Latenight news?",2020-04-27 22:04:04+00:00,0.0,2.0,,,covid
808,bkyngirl,@realDonaldTrump love how he blames someone from the past for not being prepared for the Covid -19 pandemic. Who was that? The one whom called it a hoax for all of February? The one who let thousands traveling from China and Europe?,2020-04-27 22:02:36+00:00,0.0,0.0,@realDonaldTrump,,covid
809,KatalinBogyay,"Congratulated Amb. of @AfghanMissionUN and Amb of @CroatiaUN for theur appointment by @UN_PGA to coordinate Covid19 related initiatives at General Assembly. We need action- oriented,inclusive,transparent initiatives. We work for a better “post Covid world” . ",2020-04-27 21:59:47+00:00,0.0,17.0,@AfghanMissionUN @CroatiaUN @UN_PGA,,covid
810,PilarNavaParada,"“I am optimistic that a safe and effective vaccine for COVID-19 will soon be developed, and our scientists at Pfizer are among those all over the world – across industry, government and academia – who are working tirelessly toward this goal” @pfizer #covid19 #ScienceWillWin",2020-04-27 21:59:29+00:00,1.0,0.0,@pfizer,#covid19 #ScienceWillWin,covid
811,DrKimSue,This week! Mark your calendar @harvardmed Department of Global Health and Social Medicine: “The Varieties of COVID-19 Experience.” I’ll be joining friends and mentors in Boston from NYC! https://harvard.zoom.us/j/462530489,2020-04-27 21:58:59+00:00,9.0,33.0,@harvardmed,,covid
812,B0atZ_N_H0z,*FEDEX man pulls up* Me: *outside smoking* * Head nods * FM: *Head nods* Aye you live Here ? ME: Nah I just like smoking on these steps FM: *hands package* Word. We should talk after all this COVID shiit Me: *tosses J* nah we shouldn’t,2020-04-27 21:57:38+00:00,0.0,0.0,,,covid
813,inibriated,#gofundme #covid_19 #relief #disabled #veteran #veteranowned #no #stimulus @Newark Liberty International Airport https://www.instagram.com/p/B_gAz_gDc2G/?igshid=mee6wfgikln5,2020-04-27 21:56:56+00:00,0.0,1.0,,#gofundme #covid_19 #relief #disabled #veteran #veteranowned #no #stimulus,covid
814,Jack_Hoffman,"Why not over #BergenCounty NJ, hard hit epicenter of #Covid and home of #HolyNameHospital, still fighting the virus?",2020-04-27 21:52:38+00:00,0.0,0.0,,#BergenCounty #Covid #HolyNameHospital,covid
815,ChiomaInc,"If that amount are dead, it's because if Schiff's criminally inspired chain events. He and Pelosi auctioned a hoax of an impeachment, to cover their dubious dealings. And while they peddled that nonsense, COVID-19 crept in....",2020-04-27 21:49:41+00:00,0.0,3.0,,,covid
816,diannemendez,"I not only don’t want to hear from Trump, I no longer want to hear from Dr. Birx, who has been willing to defend Trump. Dr. Fauci is the only person with any integrity in the Covid advisory group. ",2020-04-27 21:44:42+00:00,0.0,0.0,,,covid
817,ChardiaC,@edible any chance you could spare a 20% off coupon code for a special delivery for someone who lost a parent due to covid? I'm trying to place the order now. ,2020-04-27 21:43:50+00:00,0.0,0.0,@edible,,covid
818,ayoonickk1738,"Bitch I’m pyur hell but MK that’s my kenfo lil hoezz! #pyurhellgang #mk #covid_19 #drippy @West Paterson, New Jersey https://www.instagram.com/p/B_f-kXTl3aG/?igshid=w1u3qij8kl1u",2020-04-27 21:37:19+00:00,0.0,0.0,,#pyurhellgang #mk #covid_19 #drippy,covid
819,JohnEdmundsIV,Check out our Instagram at 6PM for an exclusive LIVE interview with NAACP Environment Committee Chairman @RJHarper about his Covid-19 Task Force http://Instagram.com/EyesOnNJ,2020-04-27 21:35:09+00:00,0.0,1.0,@RJHarper,,covid
820,Kizzbeth,"I call the tulips with the pointy petals Malificient Flowers. #bloomsnblossoms pawsome_pupstars #community #neighborhood #friendsofinstagram #brooklyn #plantlife #art #fightwithart #covid_19 @Brooklyn, New York https://www.instagram.com/p/B_f8yc4HHbz/?igshid=t2bxgx50i2m4",2020-04-27 21:21:46+00:00,0.0,0.0,,#bloomsnblossoms #community #neighborhood #friendsofinstagram #brooklyn #plantlife #art #fightwithart #covid_19,covid
821,CMFarahLouis,Join myself & Pastor @CharlesOG of @CRC_BK in an important Conversation on our community and the impact of COVID-19. This conversation will take place via Zoom http://zoom.us/j/99321251860 Dial in: 929.205.6099 Meeting ID: 993 2125 1860 And via @Facebook Live.,2020-04-27 21:19:44+00:00,2.0,3.0,@CharlesOG @CRC_BK @Facebook,,covid
822,drrobiludwig,"The COVID-19 economic crisis also needs to be treated as a mental health one. As a psychotherapist living in the epicenter of the pandemic, I spoke to chasingthedream to explain why. Swipe left to see part of my… https://www.instagram.com/p/B_f7vduHO3L/?igshid=1eghfa1gh2fob",2020-04-27 21:12:37+00:00,0.0,1.0,,,covid
823,DVChildCustody,Here in NYC the Epicenter of COVID-19. I’m so sorry for your lost. Your Auntie was a #frontlineSheroe she earned her “Wings” in the trenches w/other #EmergencyFirstResponders battling #TheCovidBeast Your Aunt is the Champions of Heroes my beloved ,2020-04-27 21:11:23+00:00,1.0,1.0,,#frontlineSheroe #EmergencyFirstResponders #TheCovidBeast,covid
824,LilFreakInU,"FSC: COVID-19 Tests Not Yet Effective Against On-Set Transmission, Should Not Be Part of PASS https://www.xbiz.com/news/251783/fsc-covid-19-tests-not-yet-effective-against-on-set-transmission-should-not-be-part-of-pass via @xbiz",2020-04-27 21:09:39+00:00,0.0,4.0,@XBIZ,,covid
825,Richard_Yumang,"SI Daily Cover: Less than three months ago, Laurent Duvernay-Tardif was protecting Patrick Mahomes in Super Bowl LIV. Now, the Chiefs lineman, who has a doctorate in medicine, is moving to the front lines of the COVID-19 pandemic. @SInow",2020-04-27 21:06:37+00:00,0.0,1.0,@SInow,,covid
826,ebaaraan,26 ap. 20 Covid NYC ,2020-04-27 21:04:48+00:00,54.0,111.0,,,covid
827,Robertde62,"@NYGovCuomo ...why were rates of Covid-19 so high in Westchester and Connecticut? Simple, NYC commuters. Lessons.",2020-04-27 21:03:57+00:00,0.0,0.0,@NYGovCuomo,,covid
828,theadrianmolina,Literally have had Bar Rescue in the background all day and Mannnnn this post Covid Jon Taffer content is gonna hit different. ,2020-04-27 21:00:24+00:00,0.0,1.0,,,covid
829,Jjdesosa08,Baby covid on the way!!! Scary but excited. Can’t wait to me my new bundle of joy!!,2020-04-27 20:54:11+00:00,0.0,2.0,,,covid
830,AlexandraSherer,No. She said she had “COVID-like symptoms.” She never actually had COVID.,2020-04-27 20:53:49+00:00,0.0,1.0,,,covid
831,QueenGG____,"My chinko neighbor was infected with the COVID-19 and they hid it from me, I wasn’t aware because I was still going to work when I found out I was so upset because they kept it a secret, I know I’m practing safety precautions and social distancing and the fool is not isolating",2020-04-27 20:51:37+00:00,10.0,17.0,,,covid
832,april_matthis,Thought I was getting a covid headache but it was just that my child’s underwear that I used as a mask was too tight. Two months ago this sentence would have made no sense.,2020-04-27 20:50:38+00:00,0.0,37.0,,,covid
833,Ricdeanz,COVID 19 https://twitter.com/THEICYBRAT/status/1253375283618631680,2020-04-27 20:49:18+00:00,0.0,0.0,,,covid
834,DavindranauthS,.@nygovcuomo Hundreds have already tested positive for COVID-19 in NY's prisons &amp; jails. Several have died. Reduce our prison population. Grant clemency now. ,2020-04-27 20:47:35+00:00,0.0,0.0,@NYGovCuomo,,covid
835,fabiendt,"Le tocilizumab, un médicament modulant l’immunité, améliorerait le pronostic des cas sévères de Covid, selon des résultats préliminaires annoncés lundi 27 avril. Des essais cliniques sont en cours pour freiner la production massive et toxique de cytokines chez certains patients.",2020-04-27 20:47:13+00:00,0.0,1.0,,,covid
836,bazdreisinger,"Ironically, today in lockdown we celebrate South Africa's Freedom Day: commemorating the day in 1994 when the first democratic election was held there. In honor of Freedom Day and in the face of the Covid-19… https://www.instagram.com/p/B_f4qiipWUk/?igshid=1u0qj1l4t9w0g",2020-04-27 20:45:44+00:00,0.0,1.0,,,covid
837,MarqueeNY,We're just a few hours away from @andrew_rayel taking over the marqueelv LIVESTREAM tonight at 7pm! His sets benefits the TAO Cares Covid-19 Employee Relief Fund. Please donate at http://taogroup.com/taocares @Marquee New… https://www.instagram.com/p/B_f4p4iDRnA/?igshid=b5z3txg917j2,2020-04-27 20:45:38+00:00,0.0,0.0,@Andrew_Rayel,,covid
838,AnnaFortina,"Big shout out and THANK you to Carrie Waring, Liz Fortina and @ChaeliSouv for sending love &amp; Cheryl’s Cookies to the New York Presbyterian front line! #covid_19 #frontlineworkers #newyorkpresbyterian #nyp #nyc #nystrong #pickmeup – at NewYork-Presbyterian/The Allen Hospital",2020-04-27 20:45:03+00:00,0.0,5.0,@ChaeliSouv,#covid_19 #frontlineworkers #newyorkpresbyterian #nyp #nyc #nystrong #pickmeup,covid
839,briscoe_carol,"Actually think the game was more interesting to watch back then, than it is now! Viewership of NBA games was down before Covid-19!",2020-04-27 20:42:05+00:00,0.0,0.0,,,covid
840,GiGiBunni,"Ok summer, and covid free beaches, I’m ready for you! i fucking love these bikinis i ordered from @zaful_official and i cant wait for it to be hot and less scary to go outside #nyc #brooklyn #swimsuitseason… https://www.instagram.com/p/B_f4KhYFlK7/?igshid=wa6h3wnye8ap",2020-04-27 20:41:21+00:00,0.0,0.0,@zaful_official,#nyc #brooklyn #swimsuitseason,covid
841,riverregionspts,"COVID-19 creates changes to annual Hitchcock, Sewell and Bradford Awards ",2020-04-27 20:32:19+00:00,0.0,0.0,,,covid
842,zerepyma,Call ur credit card company if you can’t meet your scheduled payments! they have covid plans available to help u out ,2020-04-27 20:30:59+00:00,0.0,3.0,,,covid
843,MaddBlackHatter,Yoo deadass...I knw our main focus rn is just preventing/surviving COVID infection but the after effects this ordeal will cause could get real ugly,2020-04-27 20:29:59+00:00,0.0,0.0,,,covid
844,HaileRivera2021,Dear Friends and Neighbors: I urge you to take advantage of this new testing site in our community and go get tested for COVID-19. Special thanks to Morris Heights Health Center for making this possible for our community. #stayhome #staysafe #thistooshallpass,2020-04-27 20:28:29+00:00,0.0,0.0,,#stayhome #stayhome #staysafe #thistooshallpass,covid
845,smdnyc,"I would suspect there’s overlap between men’s shorter life expectancy compared to women in general and this, since the health issues that cause men to die younger are some of the ones that complicate COVID.",2020-04-27 20:27:24+00:00,0.0,2.0,,,covid
846,HaileRivera2021,Dear Friends and Neighbors: I urge you to take advantage of this new site in our community and go get tested for COVID-19. Special thanks to @mhhc_inc for making this possible for our… https://www.instagram.com/p/B_f1pwrjif2MV4jsY70aYnzzMPGw4FWKGreL7o0/?igshid=19j81ft852rzm,2020-04-27 20:22:06+00:00,0.0,1.0,@MHHC_Inc,,covid
847,TheRealWize,"If I was Cuomo, I’d sue the Federal Government for the mismanagement of the Covid-19 response... I also want my unemployment that I’m entitled to... Thanks ",2020-04-27 20:21:11+00:00,0.0,1.0,,,covid
848,Salvester001,Covid,2020-04-27 20:16:31+00:00,0.0,1.0,,,covid
849,toshmalosh,Covid-19 came and really fucked shit up.,2020-04-27 20:14:56+00:00,0.0,0.0,,,covid
850,NYCMariachi,"CREANDO CONCIENCIA CONTRA EL COVID-19: Nuestro estudiante del Conservatorio De Mariachi De La Ciudad De Nueva York, Eleno Jose Valladres SE QUEDA EN CASA! #quedateencasa #stayhome “Tradicion Del Suelo Mio” THE… https://www.instagram.com/p/B_f0t7bD3tD/?igshid=1hiqbvtwxhtdx",2020-04-27 20:11:31+00:00,0.0,0.0,,#quedateencasa #quedateencasa #stayhome #stayhome,covid
851,JerseyJoe50,"At little something in the COVID-19 battle, Jersey City has reopened a few parks. But, you have to wear a mask. #JerseyCity",2020-04-27 20:09:37+00:00,0.0,0.0,,#JerseyCity,covid
852,jtp2106,Got my covid antibody results.... negative,2020-04-27 20:08:47+00:00,0.0,7.0,,,covid
853,Johnatron4000,Should I quit twitter so maybe I won’t be alone for a second covid wave? ,2020-04-27 20:07:46+00:00,0.0,8.0,,,covid
